{
  "$schema": "https://json-schema.org/draft/2020-12/schema",
  "$id": "https://faultline.invalid/contracts/release-manifest.schema.json",
  "title": "Faultline release-manifest",
  "type": "object",
  "additionalProperties": false,
  "properties": {
    "schema_version": {
      "const": 1
    },
    "release_id": {
      "type": "string",
      "pattern": "^[A-Za-z0-9][A-Za-z0-9:_-]{0,127}$"
    },
    "product": {
      "const": "Faultline"
    },
    "created_at": {
      "type": "string",
      "format": "date-time",
      "pattern": "^\\d{4}-\\d{2}-\\d{2}T\\d{2}:\\d{2}:\\d{2}\\.\\d{3}Z$"
    },
    "git_commit": {
      "type": "string",
      "pattern": "^[a-f0-9]{40}$"
    },
    "profile": {
      "type": "string",
      "enum": [
        "core_offline",
        "staging_enabled",
        "connected"
      ]
    },
    "images": {
      "type": "array",
      "items": {
        "type": "object",
        "additionalProperties": false,
        "properties": {
          "name": {
            "type": "string",
            "minLength": 1,
            "maxLength": 100
          },
          "digest": {
            "type": "string",
            "pattern": "^sha256:[a-f0-9]{64}$"
          }
        },
        "required": [
          "name",
          "digest"
        ]
      },
      "minItems": 1,
      "maxItems": 4
    },
    "migrations": {
      "type": "array",
      "items": {
        "type": "string",
        "minLength": 1,
        "maxLength": 200
      },
      "minItems": 1,
      "maxItems": 100
    },
    "evidence_ids": {
      "type": "array",
      "items": {
        "type": "string",
        "pattern": "^[A-Za-z0-9][A-Za-z0-9:_-]{0,127}$"
      },
      "minItems": 1,
      "maxItems": 1000
    },
    "gates": {
      "type": "array",
      "items": {
        "type": "object",
        "additionalProperties": false,
        "properties": {
          "id": {
            "type": "string",
            "pattern": "^[A-Za-z0-9][A-Za-z0-9:_-]{0,127}$"
          },
          "status": {
            "type": "string",
            "enum": [
              "passed",
              "failed",
              "blocked",
              "not_run",
              "not_applicable"
            ]
          },
          "evidence_path": {
            "anyOf": [
              {
                "type": "string",
                "minLength": 1,
                "maxLength": 500
              },
              {
                "type": "null"
              }
            ]
          },
          "reason": {
            "anyOf": [
              {
                "type": "string",
                "minLength": 1,
                "maxLength": 1000
              },
              {
                "type": "null"
              }
            ]
          }
        },
        "required": [
          "id",
          "status",
          "evidence_path",
          "reason"
        ]
      },
      "minItems": 1,
      "maxItems": 30
    },
    "artifacts": {
      "type": "array",
      "items": {
        "type": "object",
        "additionalProperties": false,
        "properties": {
          "path": {
            "type": "string",
            "maxLength": 240,
            "pattern": "^(?!/)(?!.*(?:^|/)\\.\\.(?:/|$))[A-Za-z0-9._/-]+$"
          },
          "sha256": {
            "type": "string",
            "pattern": "^[a-f0-9]{64}$"
          },
          "size_bytes": {
            "type": "integer",
            "minimum": 0,
            "maximum": 9007199254740991
          },
          "media_type": {
            "type": "string",
            "minLength": 1,
            "maxLength": 128
          }
        },
        "required": [
          "path",
          "sha256",
          "size_bytes",
          "media_type"
        ]
      },
      "minItems": 1,
      "maxItems": 100
    },
    "eligibility": {
      "type": "string",
      "enum": [
        "ineligible",
        "release_ready",
        "production_verified"
      ]
    },
    "limitations": {
      "type": "array",
      "items": {
        "type": "string",
        "minLength": 1,
        "maxLength": 1000
      },
      "minItems": 0,
      "maxItems": 30
    }
  },
  "required": [
    "schema_version",
    "release_id",
    "product",
    "created_at",
    "git_commit",
    "profile",
    "images",
    "migrations",
    "evidence_ids",
    "gates",
    "artifacts",
    "eligibility",
    "limitations"
  ]
}
