{
  "schema_version": 1,
  "release_id": "ineligible-design-example",
  "product": "Faultline",
  "created_at": "2026-10-09T12:00:00.000Z",
  "git_commit": "0000000000000000000000000000000000000000",
  "profile": "core_offline",
  "images": [
    {
      "name": "api-not-built",
      "digest": "sha256:a8198524f58e72b56283ab71ebddada22840f108b46ef7165bb3fca9919c5558"
    }
  ],
  "migrations": [
    "not-generated"
  ],
  "evidence_ids": [
    "reference-only"
  ],
  "gates": [
    {
      "id": "LOCAL_APP",
      "status": "not_run",
      "evidence_path": null,
      "reason": "Application not built"
    }
  ],
  "artifacts": [
    {
      "path": "events.json",
      "sha256": "a8198524f58e72b56283ab71ebddada22840f108b46ef7165bb3fca9919c5558",
      "size_bytes": 100,
      "media_type": "application/json"
    }
  ],
  "eligibility": "ineligible",
  "limitations": [
    "Schema design example only; image and artifact entries are illustrative, not produced release objects."
  ]
}
